Category_number,Category_name,Category_link,Sub_category_number,Sub_categoy_name,Sub_category_link,Index,Title,Image_link,Rating,Views,Price
4,Baby Products,"""https://www.amazon.in/gp/bestsellers/baby""",14,Strollers and Prams,"""https://www.amazon.in/gp/bestsellers/baby/1953480031""",1,"Good knight Mosquito Net for Double Bed, King-Size, Strong 30GSM net, High Durability, Foldable, Corrosion Resistant, Lightweight - Red","""https://images-eu.ssl-images-amazon.com/images/I/71YpfXdJzUS._AC_UL900_SR900600_.jpg",4.2 out of 5 stars,"10,084","Rs 1,065.00"
4,Baby Products,"""https://www.amazon.in/gp/bestsellers/baby""",14,Strollers and Prams,"""https://www.amazon.in/gp/bestsellers/baby/1953480031""",2,"LuvLap Starshine Baby Stroller / Pram for 0 to 3 Years, New Born / Toddler / Kid, Lightweight, Adjustable backrest, 360° Swivel Wheel, Large storage basket, Reversible Handlebar (Black)","""https://images-eu.ssl-images-amazon.com/images/I/81hHQ0mHe+L._AC_UL900_SR900600_.jpg",4.1 out of 5 stars,"6,109","Rs 3,699.00"
4,Baby Products,"""https://www.amazon.in/gp/bestsellers/baby""",14,Strollers and Prams,"""https://www.amazon.in/gp/bestsellers/baby/1953480031""",3,"LuvLap Sunshine Baby Stroller / Pram for 0 to 3 Years, New Born / Toddler / Kid, 5 Point Safety Harness, Adjustable backrest, 360° Swivel Wheel, Large storage basket, Reversible Handlebar (Green)","""https://images-eu.ssl-images-amazon.com/images/I/81Lb3QkwL6L._AC_UL900_SR900600_.jpg",4.1 out of 5 stars,"8,292","Rs 4,693.00"
4,Baby Products,"""https://www.amazon.in/gp/bestsellers/baby""",14,Strollers and Prams,"""https://www.amazon.in/gp/bestsellers/baby/1953480031""",4,"R for Rabbit Picaboo Baby Carry Cot, 4 in 1 Multi Purpose Kids Carry Cot, Infant Car Seat, Rocker for Infant Babies of 0 to 15 Months and Weight Capacity Upto 13 Kgs (Black Grey)","""https://images-eu.ssl-images-amazon.com/images/I/61qNwj92M0L._AC_UL900_SR900600_.jpg",4.4 out of 5 stars,538,"Rs 3,977.00"
4,Baby Products,"""https://www.amazon.in/gp/bestsellers/baby""",14,Strollers and Prams,"""https://www.amazon.in/gp/bestsellers/baby/1953480031""",5,"Good knight Mosquito Net for Single Bed, Strong 30GSM net, High Durability, Foldable, Corrosion Resistant, Lightweight - Red","""https://images-eu.ssl-images-amazon.com/images/I/616nGpr7kPL._AC_UL900_SR900600_.jpg",4.1 out of 5 stars,"1,450",Rs 879.00
4,Baby Products,"""https://www.amazon.in/gp/bestsellers/baby""",14,Strollers and Prams,"""https://www.amazon.in/gp/bestsellers/baby/1953480031""",6,StarAndDaisy Sunrise Baby Stroller and Pram with Extended Mosquito Net and Ultra Soft Cushions and Reversible Handlebar Stroller for Baby|Kids|Infants|New Born|Boys|Girls (Pi),"""https://images-eu.ssl-images-amazon.com/images/I/51U5Kzt601L._AC_UL900_SR900600_.jpg",4.3 out of 5 stars,81,"Rs 3,649.00"
4,Baby Products,"""https://www.amazon.in/gp/bestsellers/baby""",14,Strollers and Prams,"""https://www.amazon.in/gp/bestsellers/baby/1953480031""",7,"R for Rabbit Lollipop Lite Stroller and Pram with Easy Fold for Newborn Baby, Stylish, 3 Position Recline, Reversible Handle, 5 Point Safety Harness, Kids of 0 to 3 Years (Rainbow Multi Color)","""https://images-eu.ssl-images-amazon.com/images/I/61uLPYD4RNL._AC_UL900_SR900600_.jpg",4.3 out of 5 stars,"1,873","Rs 4,599.00"
4,Baby Products,"""https://www.amazon.in/gp/bestsellers/baby""",14,Strollers and Prams,"""https://www.amazon.in/gp/bestsellers/baby/1953480031""",8,LuvLap Tutti Frutti Baby Buggy -Printed Black,"""https://images-eu.ssl-images-amazon.com/images/I/61wC7Xvil9L._AC_UL900_SR900600_.jpg",4.1 out of 5 stars,"1,923","Rs 2,499.00"
4,Baby Products,"""https://www.amazon.in/gp/bestsellers/baby""",14,Strollers and Prams,"""https://www.amazon.in/gp/bestsellers/baby/1953480031""",9,"LuvLap Sunshine Baby Stroller / Pram for 0 to 3 Years, New Born / Toddler / Kid, 5 Point Safety Harness, Adjustable backrest, 360° Swivel Wheel, Large storage basket, Reversible Handlebar (Orange)","""https://images-eu.ssl-images-amazon.com/images/I/616XLjyxZUL._AC_UL900_SR900600_.jpg",4.2 out of 5 stars,"3,655","Rs 4,199.00"
4,Baby Products,"""https://www.amazon.in/gp/bestsellers/baby""",14,Strollers and Prams,"""https://www.amazon.in/gp/bestsellers/baby/1953480031""",10,"Little Pumpkin Kiddie Kingdom Baby Stroller, 3 Position Recline, Pram for Kids and Infants, Adjustable Backrest, 360° Swivel Wheel, Large Storage Basket, Reversible Handlebar, Newborn Baby Stylist Stroller for Boy and Girl of age 0 to 3 Years (Blue Black)","""https://images-eu.ssl-images-amazon.com/images/I/712WgzkiDYL._AC_UL900_SR900600_.jpg",4.3 out of 5 stars,"1,097","Rs 3,699.00"
4,Baby Products,"""https://www.amazon.in/gp/bestsellers/baby""",14,Strollers and Prams,"""https://www.amazon.in/gp/bestsellers/baby/1953480031""",11,"R for Rabbit Premium Chocolate Ride Stylish Baby Stroller and Pram for Baby, Kids, Infants, Newborn, Boys and Girls of 0 to 3 Years (Rainbow)","""https://images-eu.ssl-images-amazon.com/images/I/61ZYP1hZLfS._AC_UL900_SR900600_.jpg",4.4 out of 5 stars,769,"Rs 8,799.00"
4,Baby Products,"""https://www.amazon.in/gp/bestsellers/baby""",14,Strollers and Prams,"""https://www.amazon.in/gp/bestsellers/baby/1953480031""",12,"JoyRide 12 in 1 Premium Musical Baby Feeding Swing Rocker Carry Cot Cum Bouncer with Mosquito Net, Storage Box and Swinging Ropes (Brown Beige)","""https://images-eu.ssl-images-amazon.com/images/I/71ADboqYWdL._AC_UL900_SR900600_.jpg",3.5 out of 5 stars,68,"Rs 1,999.00"
4,Baby Products,"""https://www.amazon.in/gp/bestsellers/baby""",14,Strollers and Prams,"""https://www.amazon.in/gp/bestsellers/baby/1953480031""",13,"LuvLap Galaxy Baby Stroller, Pram for Baby with 5 Point Safety Harness, Spacious Cushioned seat with Multi Level seat Recline, Easy Fold, Lightweight Baby Stroller for 0 to 3 Years (Green and Black)","""https://images-eu.ssl-images-amazon.com/images/I/6177QzsQxZL._AC_UL900_SR900600_.jpg",4.2 out of 5 stars,"1,852","Rs 6,499.00"
4,Baby Products,"""https://www.amazon.in/gp/bestsellers/baby""",14,Strollers and Prams,"""https://www.amazon.in/gp/bestsellers/baby/1953480031""",14,"Goyal's 12 in 1 Musical Baby Feeding Swing Rocker Carry Cot Cum Bouncer with Mosquito Net, Storage Box and Swinging Ropes (Brown) (12 in 1)","""https://images-eu.ssl-images-amazon.com/images/I/61l61aTb1dL._AC_UL900_SR900600_.jpg",3.8 out of 5 stars,"1,805","Rs 2,199.00"
4,Baby Products,"""https://www.amazon.in/gp/bestsellers/baby""",14,Strollers and Prams,"""https://www.amazon.in/gp/bestsellers/baby/1953480031""",15,R For Rabbit Cutie Pie Baby Stroller and Pram | Reversible Handle and Travel Friendly Baby Stroller and Pram for Baby/Kids/Infants/Newborn | Pram and Stroller for Age 0 to 3 Years ( Black Grey),"""https://images-eu.ssl-images-amazon.com/images/I/616dzCeXsHL._AC_UL900_SR900600_.jpg",3.7 out of 5 stars,154,"Rs 5,399.00"
4,Baby Products,"""https://www.amazon.in/gp/bestsellers/baby""",14,Strollers and Prams,"""https://www.amazon.in/gp/bestsellers/baby/1953480031""",16,"ZURA Mosquito Net for Baby Cradle/Baby Jhula/Baby Swing with Zip Opening, White and Blue","""https://images-eu.ssl-images-amazon.com/images/I/31-FjiHL1PS._AC_UL900_SR900600_.jpg",4.4 out of 5 stars,"1,118",Rs 299.00
4,Baby Products,"""https://www.amazon.in/gp/bestsellers/baby""",14,Strollers and Prams,"""https://www.amazon.in/gp/bestsellers/baby/1953480031""",17,JoyRide Multipurpose Musical Carry Cot/Bouncer/Rocker with Mosquito Net and Storage Box,"""https://images-eu.ssl-images-amazon.com/images/I/71ExFyZc-7L._AC_UL900_SR900600_.jpg",3.9 out of 5 stars,428,"Rs 1,999.00"
4,Baby Products,"""https://www.amazon.in/gp/bestsellers/baby""",14,Strollers and Prams,"""https://www.amazon.in/gp/bestsellers/baby/1953480031""",18,"LuvLap Galaxy Baby Stroller, Pram for Baby with 5 Point Safety Harness, Spacious Cushioned seat with Multi Level seat Recline, Easy Fold, Lightweight Baby Stroller for 0 to 3 Years (Black)","""https://images-eu.ssl-images-amazon.com/images/I/61fmoiM0EnL._AC_UL900_SR900600_.jpg",4.1 out of 5 stars,"3,732","Rs 6,823.00"
4,Baby Products,"""https://www.amazon.in/gp/bestsellers/baby""",14,Strollers and Prams,"""https://www.amazon.in/gp/bestsellers/baby/1953480031""",19,Little Pumpkin - Baby Stroller and Pram for Baby/Newborn/Kids - Buggy for Kids | Easy Foldable and Carry |Kids Age 0-2 Years (Blue),"""https://images-eu.ssl-images-amazon.com/images/I/71dMVz-RE+L._AC_UL900_SR900600_.jpg",4.5 out of 5 stars,"1,387","Rs 2,549.00"
4,Baby Products,"""https://www.amazon.in/gp/bestsellers/baby""",14,Strollers and Prams,"""https://www.amazon.in/gp/bestsellers/baby/1953480031""",20,"LifeKrafts New and Upgraded Fabric, With Drawsting Mosquito Net for Baby Carriers, Pram, Stroller, Car Seats, Cradles. 29 x 21 Inch, Outdoor, Baby Gift, Unisex | White (1 Pack) - with 1 Free Portable Carry Pouch","""https://images-eu.ssl-images-amazon.com/images/I/71nEFnbdU4L._AC_UL900_SR900600_.jpg",4.4 out of 5 stars,"1,037",Rs 284.00
4,Baby Products,"""https://www.amazon.in/gp/bestsellers/baby""",14,Strollers and Prams,"""https://www.amazon.in/gp/bestsellers/baby/1953480031""",21,SUSI Mosquito Net for Baby Cradle/Jhula/Swing with Zip Opening for 0 to 3 Years (Lavender),"""https://images-eu.ssl-images-amazon.com/images/I/71kKcXHDbiL._AC_UL900_SR900600_.jpg",4.1 out of 5 stars,965,Rs 279.00
4,Baby Products,"""https://www.amazon.in/gp/bestsellers/baby""",14,Strollers and Prams,"""https://www.amazon.in/gp/bestsellers/baby/1953480031""",22,"Baybee Portable Infant Baby Stroller for Newborn Babies with 2-Position Adjustable, Canopy, Round Grip Handle, Safety Harness and Storage Basket | Baby Stroller for Toddlers 0-3 Years Boy Girl (Black)","""https://images-eu.ssl-images-amazon.com/images/I/7125tvo1E1L._AC_UL900_SR900600_.jpg",4.2 out of 5 stars,134,"Rs 2,999.00"
4,Baby Products,"""https://www.amazon.in/gp/bestsellers/baby""",14,Strollers and Prams,"""https://www.amazon.in/gp/bestsellers/baby/1953480031""",23,R for Rabbit Pocket Stroller Lite Baby Stroller | Travel Friendly Pre Installed Baby Stroller and Pram for Baby/Kids/Infants/Newborn | Stroller for Baby Boys and Girls of Age 0 to 3 Years (Grey),"""https://images-eu.ssl-images-amazon.com/images/I/815+DvDsOSS._AC_UL900_SR900600_.jpg",4.4 out of 5 stars,450,"Rs 6,899.00"
4,Baby Products,"""https://www.amazon.in/gp/bestsellers/baby""",14,Strollers and Prams,"""https://www.amazon.in/gp/bestsellers/baby/1953480031""",24,Mee Mee 5 in 1 Baby Cozy Carry Cot Cum Rocker (Beige),"""https://images-eu.ssl-images-amazon.com/images/I/613iWNM3m7L._AC_UL900_SR900600_.jpg",4.0 out of 5 stars,"1,150","Rs 2,129.00"
4,Baby Products,"""https://www.amazon.in/gp/bestsellers/baby""",14,Strollers and Prams,"""https://www.amazon.in/gp/bestsellers/baby/1953480031""",25,Chicco Mosquito Net for Stroller (White),"""https://images-eu.ssl-images-amazon.com/images/I/91+G916cMNL._AC_UL900_SR900600_.jpg",4.1 out of 5 stars,926,Rs 599.00
4,Baby Products,"""https://www.amazon.in/gp/bestsellers/baby""",14,Strollers and Prams,"""https://www.amazon.in/gp/bestsellers/baby/1953480031""",26,Shahji Creation Double Bed Ivory 7X7feet Best Quality Mosquito Net,"""https://images-eu.ssl-images-amazon.com/images/I/616dNRkmwwL._AC_UL900_SR900600_.jpg",3.6 out of 5 stars,"5,302",Rs 299.00
4,Baby Products,"""https://www.amazon.in/gp/bestsellers/baby""",14,Strollers and Prams,"""https://www.amazon.in/gp/bestsellers/baby/1953480031""",27,"Safe O Kid Metal Non-Slip Buggy/Pram Clips, Universal Stroller Hook for Bag Holder, Black, Pack of 2","""https://images-eu.ssl-images-amazon.com/images/I/71nxhXxDV+L._AC_UL900_SR900600_.jpg",4.3 out of 5 stars,29,Rs 349.00
4,Baby Products,"""https://www.amazon.in/gp/bestsellers/baby""",14,Strollers and Prams,"""https://www.amazon.in/gp/bestsellers/baby/1953480031""",28,Tender Care Musical 12-in-1 Carry Cot Bouncer with Storage Box and Mosquito Net for Newborn Baby (Beige),"""https://images-eu.ssl-images-amazon.com/images/I/71h4fZPCP4L._AC_UL900_SR900600_.jpg",3.8 out of 5 stars,328,"Rs 2,199.00"
4,Baby Products,"""https://www.amazon.in/gp/bestsellers/baby""",14,Strollers and Prams,"""https://www.amazon.in/gp/bestsellers/baby/1953480031""",29,"Chicco Simplicity Plus Stroller with Five-point safety harness system, Pram for boys and girls, For babies 0-4 years (Grey)","""https://images-eu.ssl-images-amazon.com/images/I/614vsNmFjTL._AC_UL900_SR900600_.jpg",4.3 out of 5 stars,42,"Rs 11,499.00"
4,Baby Products,"""https://www.amazon.in/gp/bestsellers/baby""",14,Strollers and Prams,"""https://www.amazon.in/gp/bestsellers/baby/1953480031""",30,"Chicco Cortina CX Stroller with 8-Reclining Positions, Pram for boys and girls, For babies 0-4 years (Lava, Red) Material : Polyester","""https://images-eu.ssl-images-amazon.com/images/I/71aMFEP0GjL._AC_UL900_SR900600_.jpg",4.4 out of 5 stars,135,"Rs 15,999.00"
4,Baby Products,"""https://www.amazon.in/gp/bestsellers/baby""",14,Strollers and Prams,"""https://www.amazon.in/gp/bestsellers/baby/1953480031""",31,"Chicco Echo Stroller With Bumper Bar, Pram for boys and girls, Trendy style and Safe strolling, For Babies 0-4 years (Stone, Black)","""https://images-eu.ssl-images-amazon.com/images/I/61vMMA8KJBL._AC_UL900_SR900600_.jpg",4.2 out of 5 stars,528,"Rs 6,999.00"
4,Baby Products,"""https://www.amazon.in/gp/bestsellers/baby""",14,Strollers and Prams,"""https://www.amazon.in/gp/bestsellers/baby/1953480031""",32,1st Step 5 in 1 Carrycot with Anti-Mosquito Mesh-Pink (MPKFL),"""https://images-eu.ssl-images-amazon.com/images/I/917gRB15qrL._AC_UL900_SR900600_.jpg",4.1 out of 5 stars,139,"Rs 2,209.00"
4,Baby Products,"""https://www.amazon.in/gp/bestsellers/baby""",14,Strollers and Prams,"""https://www.amazon.in/gp/bestsellers/baby/1953480031""",33,Xplore Window Cradle Cot Metal Hanger for New Born Baby (Set of 1),"""https://images-eu.ssl-images-amazon.com/images/I/51UYcF8hrqL._AC_UL900_SR900600_.jpg",4.5 out of 5 stars,10,Rs 749.00
4,Baby Products,"""https://www.amazon.in/gp/bestsellers/baby""",14,Strollers and Prams,"""https://www.amazon.in/gp/bestsellers/baby/1953480031""",34,"Chicco TrolleyMe Stroller, Pram for boys and girls, Lightweight and Easy to carry with Trolley function, For babies 0m+ (Stone, Black)","""https://images-eu.ssl-images-amazon.com/images/I/618n19bwhZL._AC_UL900_SR900600_.jpg",4.1 out of 5 stars,288,"Rs 8,999.00"
4,Baby Products,"""https://www.amazon.in/gp/bestsellers/baby""",14,Strollers and Prams,"""https://www.amazon.in/gp/bestsellers/baby/1953480031""",35,R For Rabbit Pixie Buggy and Stroller | Baby Stroller and Buggy for Baby/Newborn/Kids - Buggy for Kids | Easy Foldable and Carry | Kids Age 6 Months -3 Years (Black Grey),"""https://images-eu.ssl-images-amazon.com/images/I/71kYV6CCiXL._AC_UL900_SR900600_.jpg",4.2 out of 5 stars,56,"Rs 2,999.00"
4,Baby Products,"""https://www.amazon.in/gp/bestsellers/baby""",14,Strollers and Prams,"""https://www.amazon.in/gp/bestsellers/baby/1953480031""",36,"SNOWIE SOFT® Mosquito Net for Baby Carriage Stroller Pram,Carriers, Car Seats, Cradles, Mosquito Net Plus Size for Baby/Kids 0 to 3 Year (White)","""https://images-eu.ssl-images-amazon.com/images/I/71xU5Ci8WpS._AC_UL900_SR900600_.jpg",4.5 out of 5 stars,55,Rs 305.00
4,Baby Products,"""https://www.amazon.in/gp/bestsellers/baby""",14,Strollers and Prams,"""https://www.amazon.in/gp/bestsellers/baby/1953480031""",37,"R for Rabbit Cuppy Cake Grand Baby Stroller and Pram for Baby, Stroller and Pram With Multi Position Recline, Kids Stroller, Pram for Infants and Newborn | Stroller | Reversible handle Stroller for Boy and Girl of 0 to 3 Years (Blue Black)","""https://images-eu.ssl-images-amazon.com/images/I/719iJdHiQCL._AC_UL900_SR900600_.jpg",4.0 out of 5 stars,138,"Rs 5,399.00"
4,Baby Products,"""https://www.amazon.in/gp/bestsellers/baby""",14,Strollers and Prams,"""https://www.amazon.in/gp/bestsellers/baby/1953480031""",38,shahji creation Mosquito Net for Single Bed 3 * 6 (Light Green),"""https://images-eu.ssl-images-amazon.com/images/I/410Wu1odM1L._AC_UL900_SR900600_.jpg",3.5 out of 5 stars,"1,259",Rs 386.00
4,Baby Products,"""https://www.amazon.in/gp/bestsellers/baby""",14,Strollers and Prams,"""https://www.amazon.in/gp/bestsellers/baby/1953480031""",39,"StarAndDaisy EasyGo Travel Friendly Luxury Baby Stroller/pram/Buggy with high Landscape seat, one-Push Folding, Convertible Bassinet Design (Blue Triple Layer Cotton Fabric with Gold Tubes)","""https://images-eu.ssl-images-amazon.com/images/I/61Y0imLDXbL._AC_UL900_SR900600_.jpg",4.0 out of 5 stars,89,"Rs 8,359.00"
4,Baby Products,"""https://www.amazon.in/gp/bestsellers/baby""",14,Strollers and Prams,"""https://www.amazon.in/gp/bestsellers/baby/1953480031""",40,Tender Care 5 in 1 Baby Cozy Carry Cot Cum Roker (Blue),"""https://images-eu.ssl-images-amazon.com/images/I/7161CRcjHYL._AC_UL900_SR900600_.jpg",3.8 out of 5 stars,415,"Rs 1,449.00"
4,Baby Products,"""https://www.amazon.in/gp/bestsellers/baby""",14,Strollers and Prams,"""https://www.amazon.in/gp/bestsellers/baby/1953480031""",41,1st Step Caramel Baby Pram Cum Stroller with 5 Point Safety Harness/Infinitely Reclining and Cushioned Seat/Reversible Handle/Front Swivel Wheels - Coffee Brown,"""https://images-eu.ssl-images-amazon.com/images/I/81ggTP+yBgL._AC_UL900_SR900600_.jpg",3.6 out of 5 stars,20,"Rs 4,708.00"
4,Baby Products,"""https://www.amazon.in/gp/bestsellers/baby""",14,Strollers and Prams,"""https://www.amazon.in/gp/bestsellers/baby/1953480031""",42,"LuvLap Voyager Baby Stroller/Pram with 5 Point Safety Harness, Easy Fold, Extended Canopy, Multi Level Recline, Looking Window, Easy Assembly, 6 Month + (Blue)","""https://images-eu.ssl-images-amazon.com/images/I/81xOY8BYRtL._AC_UL900_SR900600_.jpg",4.1 out of 5 stars,"2,162","Rs 5,499.00"
4,Baby Products,"""https://www.amazon.in/gp/bestsellers/baby""",14,Strollers and Prams,"""https://www.amazon.in/gp/bestsellers/baby/1953480031""",43,"BABYHOP Foldable, Lightweight Stroller with Food Tray for 0-3 Year Baby Boys, Girls (Model Lilly, Beige) Travel Friendly with Full Canopy, 360° Wheel, Reclining Pram","""https://images-eu.ssl-images-amazon.com/images/I/61+Vnc71wzL._AC_UL900_SR900600_.jpg",3.8 out of 5 stars,112,"Rs 5,190.00"
4,Baby Products,"""https://www.amazon.in/gp/bestsellers/baby""",14,Strollers and Prams,"""https://www.amazon.in/gp/bestsellers/baby/1953480031""",44,PEAHEN 5 in 1 Baby Cozy Carry Cot Cum Rocker (Brown),"""https://images-eu.ssl-images-amazon.com/images/I/819729M1PDL._AC_UL900_SR900600_.jpg",4.0 out of 5 stars,40,"Rs 1,599.00"
4,Baby Products,"""https://www.amazon.in/gp/bestsellers/baby""",14,Strollers and Prams,"""https://www.amazon.in/gp/bestsellers/baby/1953480031""",45,"LuvLap Sunshine Baby Stroller / Pram for 0 to 3 Years, New Born / Toddler / Kid, 5 Point Safety Harness, Adjustable backrest, 360° Swivel Wheel, Large storage basket, Reversible Handlebar (Stripes)","""https://images-eu.ssl-images-amazon.com/images/I/7182kP57-LL._AC_UL900_SR900600_.jpg",4.1 out of 5 stars,941,"Rs 4,199.00"
4,Baby Products,"""https://www.amazon.in/gp/bestsellers/baby""",14,Strollers and Prams,"""https://www.amazon.in/gp/bestsellers/baby/1953480031""",46,TAVASYA 5 Feet Height X 20 Feet Length UV Stabilized PVC Balcony Safety Net_Indoor Kids Safety Net_Protection Net_Anti Bird Net_ Black Color_with 1 Cutter and 100 Tags TVUOL76,"""https://images-eu.ssl-images-amazon.com/images/I/71AEhoPjTDL._AC_UL900_SR900600_.jpg",4.1 out of 5 stars,15,"Rs 1,299.00"
4,Baby Products,"""https://www.amazon.in/gp/bestsellers/baby""",14,Strollers and Prams,"""https://www.amazon.in/gp/bestsellers/baby/1953480031""",47,Ans Mosquito Net HDPE Quality Net (5 x 6.5 ft Queen Size Bed),"""https://images-eu.ssl-images-amazon.com/images/I/617za9B11pL._AC_UL900_SR900600_.jpg",4.0 out of 5 stars,2,Rs 499.00
4,Baby Products,"""https://www.amazon.in/gp/bestsellers/baby""",14,Strollers and Prams,"""https://www.amazon.in/gp/bestsellers/baby/1953480031""",48,Mee Mee Baby Car Seat Cum Carry Cot with Thick Cushioned Seat (Pista Green),"""https://images-eu.ssl-images-amazon.com/images/I/51YrlG-j2nS._AC_UL900_SR900600_.jpg",4.0 out of 5 stars,2,"Rs 1,699.00"
4,Baby Products,"""https://www.amazon.in/gp/bestsellers/baby""",14,Strollers and Prams,"""https://www.amazon.in/gp/bestsellers/baby/1953480031""",49,"INFANTSO Multi-Purpose Portable Folding Outdoor Travel Baby Wash Basin/Tub/Storage Basket, Anti-Skid, Large Capacity (Basin P)","""https://images-eu.ssl-images-amazon.com/images/I/51bfS9WIF2L._AC_UL900_SR900600_.jpg",4.3 out of 5 stars,191,"Rs 3,421.00"
4,Baby Products,"""https://www.amazon.in/gp/bestsellers/baby""",14,Strollers and Prams,"""https://www.amazon.in/gp/bestsellers/baby/1953480031""",50,,"""https://images-eu.ssl-images-amazon.com/images/I/41DvsX8QtdS._AC_UL900_SR900600_.jpg",4.0 out of 5 stars,12,Rs 279.00
