Category_number,Category_name,Category_link,Sub_category_number,Sub_categoy_name,Sub_category_link,Index,Title,Image_link,Rating,Views,Price
31,Watches,"""https://www.amazon.in/gp/bestsellers/watches""",5,Women,"""https://www.amazon.in/gp/bestsellers/watches/2563505031""",1,"SENS NUTON 1 with 1.7 IPS Display, Orbiter, 5ATM and 150+ Watch Faces and Free Additional Strap (Matte Black)","""https://images-eu.ssl-images-amazon.com/images/I/61amvAo9DtL._AC_UL900_SR900600_.jpg",3.9 out of 5 stars,341,"Rs 1,199.00"
31,Watches,"""https://www.amazon.in/gp/bestsellers/watches""",5,Women,"""https://www.amazon.in/gp/bestsellers/watches/2563505031""",2,"New Fastrack Reflex VOX 2.0 Smart Watch|BT Calling|1.8"" HD Display|Music Storage|TWS Connect|AI Voice|50+ Sports Modes|100+ Watchfaces|24x7 HRM|BP Monitor|SpO2|Sleep Tracker|Fast Charge|5 Day Battery*","""https://images-eu.ssl-images-amazon.com/images/I/61lYvGXEysL._AC_UL900_SR900600_.jpg",4.3 out of 5 stars,83,"Rs 4,995.00"
31,Watches,"""https://www.amazon.in/gp/bestsellers/watches""",5,Women,"""https://www.amazon.in/gp/bestsellers/watches/2563505031""",3,IMPERIOUS - THE ROYAL WAY Analogue Women's Watch (Black Dial),"""https://images-eu.ssl-images-amazon.com/images/I/51LTJjshaIL._AC_UL900_SR900600_.jpg",3.9 out of 5 stars,"5,731",Rs 759.00
31,Watches,"""https://www.amazon.in/gp/bestsellers/watches""",5,Women,"""https://www.amazon.in/gp/bestsellers/watches/2563505031""",4,Matrix Kids Edition Spiderman/Frozen/Ben 10 / Hello Kitty Digital Watch for Kids with Disco LED Lights (Boys and Girls),"""https://images-eu.ssl-images-amazon.com/images/I/71m7syiVCNL._AC_UL900_SR900600_.jpg",3.9 out of 5 stars,721,Rs 319.00
31,Watches,"""https://www.amazon.in/gp/bestsellers/watches""",5,Women,"""https://www.amazon.in/gp/bestsellers/watches/2563505031""",5,Fastrack New Reflex Play|AMOLED Display|100 + Watchfaces|in-Built Games|24x7 HRM|BP Monitor|SpO2|Sleep Monitor|25+ Sports Modes|Custom Watchface|7 Day* Battery|Camera and Music Control|IP68,"""https://images-eu.ssl-images-amazon.com/images/I/71MXBWGALUL._AC_UL900_SR900600_.jpg",3.3 out of 5 stars,612,"Rs 3,995.00"
31,Watches,"""https://www.amazon.in/gp/bestsellers/watches""",5,Women,"""https://www.amazon.in/gp/bestsellers/watches/2563505031""",6,Matrix Men's Day and Date Display Analog Wrist Watch,"""https://images-eu.ssl-images-amazon.com/images/I/71GtycnHMtL._AC_UL900_SR900600_.jpg",3.6 out of 5 stars,"2,295",Rs 299.00
31,Watches,"""https://www.amazon.in/gp/bestsellers/watches""",5,Women,"""https://www.amazon.in/gp/bestsellers/watches/2563505031""",7,"Fastrack Reflex Activity Tracker - Full Touch, Color Display, Notification Alert - Upto 7 Days Battery Life","""https://images-eu.ssl-images-amazon.com/images/I/71-i9q1lVPL._AC_UL900_SR900600_.jpg",3.8 out of 5 stars,"11,531","Rs 1,795.00"
31,Watches,"""https://www.amazon.in/gp/bestsellers/watches""",5,Women,"""https://www.amazon.in/gp/bestsellers/watches/2563505031""",8,LOUIS DEVIN LD-L144-BLU-CH Mesh Steel Chain Analog Wrist Watch for Women,"""https://images-eu.ssl-images-amazon.com/images/I/81jnv+iz+ZL._AC_UL900_SR900600_.jpg",4.0 out of 5 stars,"4,933",Rs 299.00
31,Watches,"""https://www.amazon.in/gp/bestsellers/watches""",5,Women,"""https://www.amazon.in/gp/bestsellers/watches/2563505031""",9,"Fossil Gen 5E Smartwatch with AMOLED Screen, Wear OS by Google, Built-in Speaker for Phone Calls, Google Assistant, SpO2, GPS, NFC, Wellness Features and Smartphone Notifications","""https://images-eu.ssl-images-amazon.com/images/I/81gU0NVV5WL._AC_UL900_SR900600_.jpg",3.9 out of 5 stars,"11,637","Rs 11,995.00"
31,Watches,"""https://www.amazon.in/gp/bestsellers/watches""",5,Women,"""https://www.amazon.in/gp/bestsellers/watches/2563505031""",10,"Fossil Gen 5 Touchscreen Men's Smartwatch with Speaker, Heart Rate, GPS, Music Storage and Smartphone Notifications","""https://images-eu.ssl-images-amazon.com/images/I/71qNX0wixBL._AC_UL900_SR900600_.jpg",3.9 out of 5 stars,"14,459","Rs 9,198.00"
31,Watches,"""https://www.amazon.in/gp/bestsellers/watches""",5,Women,"""https://www.amazon.in/gp/bestsellers/watches/2563505031""",11,"Fastrack New Reflex Hello|BT Calling|1.69” HD Display|50+ Sports Modes|100+,Watchfaces|Game|BP Monitor|24x7 HRM| SpO2|Sleep Monitor|Custom Watchface|5Days* Battery|Camera and Music Control|IP68","""https://images-eu.ssl-images-amazon.com/images/I/61AigzIaAwL._AC_UL900_SR900600_.jpg",3.8 out of 5 stars,331,"Rs 3,995.00"
31,Watches,"""https://www.amazon.in/gp/bestsellers/watches""",5,Women,"""https://www.amazon.in/gp/bestsellers/watches/2563505031""",12,Matrix Day and Date Analog Wrist Watch for Men and Boys (Black),"""https://images-eu.ssl-images-amazon.com/images/I/71UXbfMHImS._AC_UL900_SR900600_.jpg",3.6 out of 5 stars,"3,391",Rs 299.00
31,Watches,"""https://www.amazon.in/gp/bestsellers/watches""",5,Women,"""https://www.amazon.in/gp/bestsellers/watches/2563505031""",13,Fastrack New Reflex Vybe Smart Watch|1.5” HD Display|50+ Sports Modes|100+ Watchfaces|in-Built Game|BP Monitor|24x7 HRM|SpO2|Sleep Tracker|Custom Watchface|7 Day Battery|Camera and Music Control|IP68,"""https://images-eu.ssl-images-amazon.com/images/I/61zaXe0s29L._AC_UL900_SR900600_.jpg",3.7 out of 5 stars,332,"Rs 2,995.00"
31,Watches,"""https://www.amazon.in/gp/bestsellers/watches""",5,Women,"""https://www.amazon.in/gp/bestsellers/watches/2563505031""",14,On Time Octus Analog Girl's and Women's Watch (Multi Color Dial Multi-Colored Strap),"""https://images-eu.ssl-images-amazon.com/images/I/71oCNMI1B1L._AC_UL900_SR900600_.jpg",4.1 out of 5 stars,362,Rs 239.00
31,Watches,"""https://www.amazon.in/gp/bestsellers/watches""",5,Women,"""https://www.amazon.in/gp/bestsellers/watches/2563505031""",15,SWADESI STUFF White Dial Barbie Love Watch Series Analogue Girl's Watch,"""https://images-eu.ssl-images-amazon.com/images/I/71iPnemk9nL._AC_UL900_SR900600_.jpg",3.4 out of 5 stars,"2,052",Rs 189.00
31,Watches,"""https://www.amazon.in/gp/bestsellers/watches""",5,Women,"""https://www.amazon.in/gp/bestsellers/watches/2563505031""",16,Acnos Brand - A Digital Watch Shockproof Multi-Functional Automatic 5 Color Army Strap Waterproof Digital Sports Watch for Men's Kids Watch for Boys Watch for Men Pack of 1,"""https://images-eu.ssl-images-amazon.com/images/I/61wP1+eh4+S._AC_UL900_SR900600_.jpg",4.0 out of 5 stars,605,Rs 284.00
31,Watches,"""https://www.amazon.in/gp/bestsellers/watches""",5,Women,"""https://www.amazon.in/gp/bestsellers/watches/2563505031""",17,MARCLEX Branded Analogue Diamond Studded Black Dial Magnet Watch With Gift Bracelet For Women Or Girls And Watch For Girl Or Women (Combo Of 3),"""https://images-eu.ssl-images-amazon.com/images/I/91LX5DDxBtL._AC_UL900_SR900600_.jpg",3.8 out of 5 stars,"1,531",Rs 299.00
31,Watches,"""https://www.amazon.in/gp/bestsellers/watches""",5,Women,"""https://www.amazon.in/gp/bestsellers/watches/2563505031""",18,STYLEDOSE Branded Analogue Black Dial Magnet Watch With Gift Bracelet For Women Or Girls And Watch For Girl Or Women (Combo Of 3),"""https://images-eu.ssl-images-amazon.com/images/I/91zvsjtEEDL._AC_UL900_SR900600_.jpg",3.9 out of 5 stars,"5,514",Rs 299.00
31,Watches,"""https://www.amazon.in/gp/bestsellers/watches""",5,Women,"""https://www.amazon.in/gp/bestsellers/watches/2563505031""",19,ADAMO Analog Rose Gold Dial Women's Watch-839KKM21,"""https://images-eu.ssl-images-amazon.com/images/I/61uY-wl4OdL._AC_UL900_SR900600_.jpg",3.8 out of 5 stars,"4,229",Rs 299.00
31,Watches,"""https://www.amazon.in/gp/bestsellers/watches""",5,Women,"""https://www.amazon.in/gp/bestsellers/watches/2563505031""",20,PAPIO Women's Analog Watches,"""https://images-eu.ssl-images-amazon.com/images/I/81rLu6RKYPL._AC_UL900_SR900600_.jpg",3.7 out of 5 stars,"1,940",Rs 165.00
31,Watches,"""https://www.amazon.in/gp/bestsellers/watches""",5,Women,"""https://www.amazon.in/gp/bestsellers/watches/2563505031""",21,SWISSTONE JEWELS068-PNKSLV Silver Plated Bracelet Wrist Watch for Women,"""https://images-eu.ssl-images-amazon.com/images/I/817iC5Eq49L._AC_UL900_SR900600_.jpg",4.1 out of 5 stars,"11,409",Rs 399.00
31,Watches,"""https://www.amazon.in/gp/bestsellers/watches""",5,Women,"""https://www.amazon.in/gp/bestsellers/watches/2563505031""",22,SELLORIA Digital Watch Shockproof Multi-Functional Automatic Black Color Strap Waterproof Digital Sports Watch for Mens Kids Watch for Boys Watch for Men Pack of 1 Watch Water Resistance Digital Watch,"""https://images-eu.ssl-images-amazon.com/images/I/61YTgYOiedL._AC_UL900_SR900600_.jpg",3.8 out of 5 stars,289,Rs 199.00
31,Watches,"""https://www.amazon.in/gp/bestsellers/watches""",5,Women,"""https://www.amazon.in/gp/bestsellers/watches/2563505031""",23,Fastrack Reflex Play + with BT Calling|AMOLED Display|100 + Watchfaces|24x7 HRM|BP Monitor|SpO2 Monitor|Sleep Monitor| Multiple Sports Modes|Custom Watchface|7 Day* Battery|IP68 Water Resistance,"""https://images-eu.ssl-images-amazon.com/images/I/61sJzENDv2L._AC_UL900_SR900600_.jpg",3.8 out of 5 stars,386,"Rs 6,995.00"
31,Watches,"""https://www.amazon.in/gp/bestsellers/watches""",5,Women,"""https://www.amazon.in/gp/bestsellers/watches/2563505031""",24,"Newly Launched Maxima Max Pro Knight Bluetooth Calling smartwatch with 44.5mm Round Active Display of 550 Nits Brightness, Voice Assistant, HR and SpO2 Monitor,30+ Excercise Modes, inbuilt Games","""https://images-eu.ssl-images-amazon.com/images/I/713o328GByL._AC_UL900_SR900600_.jpg",3.6 out of 5 stars,799,"Rs 2,699.00"
31,Watches,"""https://www.amazon.in/gp/bestsellers/watches""",5,Women,"""https://www.amazon.in/gp/bestsellers/watches/2563505031""",25,Acnos Brand - A Watch Analogue Plain Black Dial Magnet Watch With Gift Bracelet For Women Or Girls And Watch For Girl Or Women (Combo Of 3),"""https://images-eu.ssl-images-amazon.com/images/I/71fPWK0Pe6S._AC_UL900_SR900600_.jpg",3.9 out of 5 stars,554,Rs 299.00
31,Watches,"""https://www.amazon.in/gp/bestsellers/watches""",5,Women,"""https://www.amazon.in/gp/bestsellers/watches/2563505031""",26,IIK Collection Elegant Round Dial Stainless Steel Bracelet Chain Analogue Watch for Women and Girls,"""https://images-eu.ssl-images-amazon.com/images/I/716F4vFHAWL._AC_UL900_SR900600_.jpg",3.9 out of 5 stars,"2,315",Rs 341.00
31,Watches,"""https://www.amazon.in/gp/bestsellers/watches""",5,Women,"""https://www.amazon.in/gp/bestsellers/watches/2563505031""",27,TIMEX Analog Women's Watch,"""https://images-eu.ssl-images-amazon.com/images/I/61fc1SNU8TS._AC_UL900_SR900600_.jpg",4.4 out of 5 stars,"1,438","Rs 2,157.00"
31,Watches,"""https://www.amazon.in/gp/bestsellers/watches""",5,Women,"""https://www.amazon.in/gp/bestsellers/watches/2563505031""",28,Acnos Girl's Special Quality Different Heart Shape Bangle Analog Watch with Rose Gold Bracelet - Pack of 2,"""https://images-eu.ssl-images-amazon.com/images/I/81vriFi1PoL._AC_UL900_SR900600_.jpg",4.0 out of 5 stars,564,Rs 269.00
31,Watches,"""https://www.amazon.in/gp/bestsellers/watches""",5,Women,"""https://www.amazon.in/gp/bestsellers/watches/2563505031""",29,Fossil Analog Rose Gold Dial Women's Watch-BQ3181,"""https://images-eu.ssl-images-amazon.com/images/I/611I0f+I+MS._AC_UL900_SR900600_.jpg",4.5 out of 5 stars,"2,730","Rs 6,170.00"
31,Watches,"""https://www.amazon.in/gp/bestsellers/watches""",5,Women,"""https://www.amazon.in/gp/bestsellers/watches/2563505031""",30,On Time Octus Digital Boy's and Girl's Watch DIGITAL-08 (Grey Dial Multicolour Strap),"""https://images-eu.ssl-images-amazon.com/images/I/71KSeyXsg-L._AC_UL900_SR900600_.jpg",3.7 out of 5 stars,"1,624",Rs 229.00
31,Watches,"""https://www.amazon.in/gp/bestsellers/watches""",5,Women,"""https://www.amazon.in/gp/bestsellers/watches/2563505031""",31,SWADESI STUFF Square Multi DIAL Analog Silicon Strap ADDI Stylish Designer Analog Watch - for Boys,"""https://images-eu.ssl-images-amazon.com/images/I/71H1EnshRiL._AC_UL900_SR900600_.jpg",3.5 out of 5 stars,"2,607",Rs 170.00
31,Watches,"""https://www.amazon.in/gp/bestsellers/watches""",5,Women,"""https://www.amazon.in/gp/bestsellers/watches/2563505031""",32,"Fastrack Analog Dial Women's Watch (Pink, 6150SM04)-NM6150SM04 / NL6150SM04/NP6150SM04","""https://images-eu.ssl-images-amazon.com/images/I/71S8hn6xv4L._AC_UL900_SR900600_.jpg",4.4 out of 5 stars,"7,636","Rs 1,435.00"
31,Watches,"""https://www.amazon.in/gp/bestsellers/watches""",5,Women,"""https://www.amazon.in/gp/bestsellers/watches/2563505031""",33,Joker and Witch Women's Nebula Black Dial Analog Watch (Rose Gold ),"""https://images-eu.ssl-images-amazon.com/images/I/61UTf1uvl9L._AC_UL900_SR900600_.jpg",3.8 out of 5 stars,72,Rs 799.00
31,Watches,"""https://www.amazon.in/gp/bestsellers/watches""",5,Women,"""https://www.amazon.in/gp/bestsellers/watches/2563505031""",34,TIMEX Analog Women's Watch,"""https://images-eu.ssl-images-amazon.com/images/I/71Yl+kTwWwL._AC_UL900_SR900600_.jpg",4.3 out of 5 stars,"1,881","Rs 1,979.00"
31,Watches,"""https://www.amazon.in/gp/bestsellers/watches""",5,Women,"""https://www.amazon.in/gp/bestsellers/watches/2563505031""",35,Acnos Analogue Women's Rose-Gold Magnet Watch With Rosegold Bracelet With Gift Box,"""https://images-eu.ssl-images-amazon.com/images/I/71nbOk-3qUL._AC_UL900_SR900600_.jpg",4.0 out of 5 stars,621,Rs 285.00
31,Watches,"""https://www.amazon.in/gp/bestsellers/watches""",5,Women,"""https://www.amazon.in/gp/bestsellers/watches/2563505031""",36,NIBOSI Women Watches Bracelet Watch Ladies Wrist Watch Women Waterproof Fashion Casual Crystal Dial Rose Gold,"""https://images-eu.ssl-images-amazon.com/images/I/61xuL9-N-nL._AC_UL900_SR900600_.jpg",4.1 out of 5 stars,669,"Rs 1,999.00"
31,Watches,"""https://www.amazon.in/gp/bestsellers/watches""",5,Women,"""https://www.amazon.in/gp/bestsellers/watches/2563505031""",37,NIBOSI Women Watches Analogue Wrist Watches Watches for Women's and GirlsandMissandLadies Rose Gold Dial Watch with Stylish Diamond Studded Watches,"""https://images-eu.ssl-images-amazon.com/images/I/71GUXx8a82L._AC_UL900_SR900600_.jpg",4.0 out of 5 stars,300,"Rs 1,899.00"
31,Watches,"""https://www.amazon.in/gp/bestsellers/watches""",5,Women,"""https://www.amazon.in/gp/bestsellers/watches/2563505031""",38,Sonata Fashion Fibre Analog Black Dial Women's Watch NM8992PP02/NN8992PP02,"""https://images-eu.ssl-images-amazon.com/images/I/61pTlT2b7FL._AC_UL900_SR900600_.jpg",4.0 out of 5 stars,"4,530",Rs 559.00
31,Watches,"""https://www.amazon.in/gp/bestsellers/watches""",5,Women,"""https://www.amazon.in/gp/bestsellers/watches/2563505031""",39,Sonata Analog White Dial Men's Watch -NJ7987YL02W,"""https://images-eu.ssl-images-amazon.com/images/I/71h4VpmW0uL._AC_UL900_SR900600_.jpg",4.2 out of 5 stars,"5,636",Rs 519.00
31,Watches,"""https://www.amazon.in/gp/bestsellers/watches""",5,Women,"""https://www.amazon.in/gp/bestsellers/watches/2563505031""",40,Acnos Brand - A Digital Watch with Square LED Shockproof Multi-Functional Automatic 5 Color Army Strap Waterproof Digital Sports Watch for Men's Kids Watch for Boys - Watch for Men,"""https://images-eu.ssl-images-amazon.com/images/I/712zWWSuGPL._AC_UL900_SR900600_.jpg",3.6 out of 5 stars,"1,828",Rs 320.00
31,Watches,"""https://www.amazon.in/gp/bestsellers/watches""",5,Women,"""https://www.amazon.in/gp/bestsellers/watches/2563505031""",41,Daniel Klein Analog Black Dial Women's Watch-DK11421-5,"""https://images-eu.ssl-images-amazon.com/images/I/61q6wOFoAQL._AC_UL900_SR900600_.jpg",4.1 out of 5 stars,"1,497",Rs 951.00
31,Watches,"""https://www.amazon.in/gp/bestsellers/watches""",5,Women,"""https://www.amazon.in/gp/bestsellers/watches/2563505031""",42,Titan Karishma Revive Analog Champagne Dial Women's Watch-NL2594YM01,"""https://images-eu.ssl-images-amazon.com/images/I/61M-iMX3f9L._AC_UL900_SR900600_.jpg",4.3 out of 5 stars,945,"Rs 1,595.00"
31,Watches,"""https://www.amazon.in/gp/bestsellers/watches""",5,Women,"""https://www.amazon.in/gp/bestsellers/watches/2563505031""",43,Fastrack Tropical Waters Analog Green Dial Women's Watch-NL68008SM07/NP68008SM07,"""https://images-eu.ssl-images-amazon.com/images/I/71OKNZr3SmL._AC_UL900_SR900600_.jpg",4.4 out of 5 stars,525,"Rs 1,099.00"
31,Watches,"""https://www.amazon.in/gp/bestsellers/watches""",5,Women,"""https://www.amazon.in/gp/bestsellers/watches/2563505031""",44,LORENZ Analogue Men's Watch ( Black Dial and Strap ),"""https://images-eu.ssl-images-amazon.com/images/I/81b7F7ZltiL._AC_UL900_SR900600_.jpg",3.6 out of 5 stars,"1,140",Rs 269.00
31,Watches,"""https://www.amazon.in/gp/bestsellers/watches""",5,Women,"""https://www.amazon.in/gp/bestsellers/watches/2563505031""",45,Louis Devin Women's Analog Wrist Watch with Stainless Steel Chain | LD-L157,"""https://images-eu.ssl-images-amazon.com/images/I/71XzZbjhryL._AC_UL900_SR900600_.jpg",4.0 out of 5 stars,60,Rs 299.00
31,Watches,"""https://www.amazon.in/gp/bestsellers/watches""",5,Women,"""https://www.amazon.in/gp/bestsellers/watches/2563505031""",46,Timex Classics Analog White Dial Women's Watch-B300,"""https://images-eu.ssl-images-amazon.com/images/I/61KcsQohF2L._AC_UL900_SR900600_.jpg",4.2 out of 5 stars,768,Rs 671.00
31,Watches,"""https://www.amazon.in/gp/bestsellers/watches""",5,Women,"""https://www.amazon.in/gp/bestsellers/watches/2563505031""",47,"New Maxima Max Pro Hero Smart Watch| Advanced Dual Chip Bluetooth Calling| Largest Display 1.83""| 600 Nits Brightness| 100+ Sports Mode| Premium Metal Design| 24X7HR,SpO2, Sleep Monitor| Inbuilt Games","""https://images-eu.ssl-images-amazon.com/images/I/61Ae0OqnhXL._AC_UL900_SR900600_.jpg",4.2 out of 5 stars,5,"Rs 2,499.00"
31,Watches,"""https://www.amazon.in/gp/bestsellers/watches""",5,Women,"""https://www.amazon.in/gp/bestsellers/watches/2563505031""",48,Acnos Brand - A Taymex Digital Watch Shockproof Multi-Functional Automatic Black Strap Waterproof Digital Sports Watch For Men's Kids Watch For Boys - Watch For Men Pack Of 1,"""https://images-eu.ssl-images-amazon.com/images/I/71oJdpw3YXL._AC_UL900_SR900600_.jpg",4.1 out of 5 stars,799,Rs 285.00
31,Watches,"""https://www.amazon.in/gp/bestsellers/watches""",5,Women,"""https://www.amazon.in/gp/bestsellers/watches/2563505031""",49,Acnos Women’s 4 Dial Black-Blue-Pink-White Stainless Steel Silver Band Analogue Watch with Heart Diamond Silver Bracelet,"""https://images-eu.ssl-images-amazon.com/images/I/61kp-KtbQeL._AC_UL900_SR900600_.jpg",4.1 out of 5 stars,"1,285",Rs 284.00
31,Watches,"""https://www.amazon.in/gp/bestsellers/watches""",5,Women,"""https://www.amazon.in/gp/bestsellers/watches/2563505031""",50,"Titan Smart 2 Fashion Smartwatch, 1.78” AMOLED Display with Premium Metal Body, Multiple Sports Modes with 100+ Watchfaces, Complete Health Suite with Stress Monitor, 7 Days Battery Life and 3 ATM","""https://images-eu.ssl-images-amazon.com/images/I/61ZA85fi2ML._AC_UL900_SR900600_.jpg",4.0 out of 5 stars,393,"Rs 6,995.00"
